holland_group,big5_group,career_ids,reasoning
0,0,"[156, 157, 165, 170, 198, 260]",สามารถสื่อสารและถ่ายทอดข้อมูลได้อย่างชัดเจน รวมถึงจัดการงานอย่างมีขั้นตอน ไม่หลุดรายละเอียด และรักษามาตรฐานการทำงานได้ดี
0,1,"[115, 207, 230, 278]", เรียนรู้และปรับตัวเข้ากับเทคโนโลยีหรือนวัตกรรมใหม่ได้ดี มีทักษะการสื่อสารและประสานงานกับผู้อื่น ทำงานเป็นทีมได้อย่างมีประสิทธิภาพ
0,2,"[12, 39, 41, 42, 44, 46, 53, 55, 56, 58, 60, 100, 139, 146, 182, 234]", สามารถคิดเชิงวิเคราะห์ได้อย่างรอบคอบ มองเห็นความเชื่อมโยงของข้อมูล และเข้าใจผลกระทบที่ข้อมูลมีต่อการตัดสินใจ
0,3,"[112, 158, 159, 167, 168]", สามารถสร้างความสัมพันธ์ที่ดีกับผู้อื่น เห็นอกเห็นใจ และจัดการอารมณ์หรือความเครียดได้เมื่อทำงานในสภาพแวดล้อมที่มีแรงกดดัน
0,4,"[31, 32, 43, 45, 52, 54, 59, 61, 62, 63, 64, 101, 108, 111, 138, 141, 149, 150, 166, 199]", ใส่ใจทุกรายละเอียดของงาน ไม่มองข้ามข้อผิดพลาด และสามารถวิเคราะห์ข้อมูลหรือปัญหาที่มีความซับซ้อนได้อย่างเป็นระบบ
0,5,"[67, 89, 185, 206, 254, 255, 257]",สามารถบริหารจัดการทีมงานได้ดี เข้าใจความต้องการของคนในทีม และมีทักษะในการวางแผนเพื่อมุ่งสู่เป้าหมายที่กำหนดไว้อย่างชัดเจน
1,0,"[16, 208, 214, 223, 224, 244, 269]", สามารถทำงานได้อย่างมีประสิทธิภาพแม้ภายใต้ข้อจำกัดของเวลาและความกดดัน พร้อมรับมือกับความท้าทายได้ดี
1,1,"[48, 72, 74, 82, 107, 109, 136, 147, 161, 162, 176, 265]", มีความสามารถในการสร้างสรรค์สิ่งใหม่ๆ เปิดรับความคิดและวิธีการใหม่ๆ และกล้าแสดงออกเพื่อพัฒนาและต่อยอดไอเดียให้เกิดประโยชน์
1,2,"[28, 30, 51, 178, 180, 203, 279]", มีความสามารถในการทำความเข้าใจเรื่องที่ซับซ้อน ไม่ว่าจะเป็นระบบ กระบวนการ หรือธรรมชาติของงาน และสามารถเจาะลึกเนื้อหาได้ดี
1,3,"[113, 164, 185, 186]", มีทักษะในการดูแลและสนับสนุนผู้อื่น โดยเฉพาะในด้านสุขภาพและการฟื้นฟูร่างกาย พร้อมทั้งเข้าใจความหลากหลายของผู้คน
1,4,"[3, 5, 6, 7, 8, 9, 10, 11, 13, 17, 19, 20, 21, 22, 25, 26, 27, 29, 33, 34, 35, 36, 38, 145, 154, 155, 213, 215, 220, 237, 240, 242]", ทำงานได้อย่างแม่นยำ ใส่ใจรายละเอียด และไม่ยึดติดกับวิธีเดิม พร้อมเปิดรับและทดลองวิธีใหม่ๆ เพื่อแก้ปัญหา
1,5,"[183,182]", วางแผนการทำงานได้เป็นระบบ และมุ่งมั่นทำงานให้สำเร็จตามเป้าหมาย พร้อมประสานงานกับทุกฝ่ายได้อย่างราบรื่น
2,0,"[38, 210, 230]", สามารถบริหารจัดการงานบริการหรือโลจิสติกส์ที่มีขั้นตอนหลากหลายได้อย่างมีประสิทธิภาพ พร้อมทั้งสื่อสารกับลูกค้าหรือทีมได้ดี
2,1,"[83, 84, 86, 87, 91, 243]", ชอบการสร้างสรรค์สิ่งใหม่ กล้าแสดงออก และสามารถทำงานที่เกี่ยวข้องกับการนำเสนอหรือปฏิสัมพันธ์กับคนจำนวนมากได้ดี
2,2,"[95, 102, 103, 104, 151]", ให้ความสำคัญกับความถูกต้องและผลกระทบของข้อมูล วิเคราะห์ปัญหาได้อย่างรอบคอบและละเอียด
2,3,"[188, 69, 71, 209]", สามารถปรับตัวและจัดการงานที่ต้องสื่อสารกับคนหลากหลาย พร้อมเข้าใจความต้องการที่แท้จริงของผู้ใช้งาน
2,4,"[85, 86, 87, 88, 195, 196, 211]", สามารถวางแผนงานได้เป็นขั้นตอน ชัดเจน และแม่นยำในทุกรายละเอียดเพื่อให้บรรลุเป้าหมายได้อย่างมีประสิทธิภาพ
2,5,"[83, 84, 87, 114]", เข้าใจบทบาทผู้นำที่ดี วางเป้าหมายได้ชัดเจน และสามารถสร้างแรงบันดาลใจให้ทีมมีแรงผลักดันในการทำงาน
3,0,"[204, 208, 243, 244]", สามารถดูแล สนับสนุน หรือช่วยแก้ปัญหาให้ผู้อื่นได้อย่างจริงใจ พร้อมวางระบบการทำงานให้เกิดประสิทธิภาพสูงสุด
3,1,"[47, 116, 135, 203]", กล้าเปิดรับมุมมองใหม่ๆ และคิดค้นไอเดียสร้างสรรค์เพื่อพัฒนางานหรือแก้ไขปัญหาได้อย่างโดดเด่น
3,2,"[83, 84, 86, 87, 91, 243]", เข้าใจความสำคัญของข้อมูลที่เกี่ยวข้องกับผู้คนหรือองค์กร และสามารถจัดการได้อย่างปลอดภัยและรอบคอบ 
3,3,"[188, 69, 71, 209]", มีความเข้าใจในประสบการณ์ของผู้ใช้หรือผู้รับบริการ พร้อมจัดการงานให้สำเร็จแม้ในสถานการณ์ที่มีข้อจำกัด
3,4,"[40, 51, 65, 133, 134, 140, 152, 153, 243, 281]", สามารถวิเคราะห์ข้อมูลหรือปัญหาที่ซับซ้อนได้อย่างเข้าใจ พร้อมวางแผนและจัดการงานให้ได้ผลลัพธ์ตามเป้าหมาย
3,5,"[83, 84, 88, 91]", สามารถสร้างสรรค์ผลงาน ทำงานร่วมกับหลายฝ่าย และมุ่งเน้นผลลัพธ์ที่ตอบโจทย์ความต้องการของตลาดหรือองค์กร
4,0,"[90, 92, 189]",สามารถนำเสนอข้อมูลหรือประสานงานได้อย่างชัดเจน วางแผนและลงมือทำงานได้อย่างแม่นยำ รวดเร็ว และมีประสิทธิภาพ แม้จะอยู่ภายใต้ข้อจำกัดของเวลา
4,1,"[93, 94, 105, 106, 163, 192, 271]", มีความคิดสร้างสรรค์ เปิดรับแนวคิดใหม่ ๆ และกล้าแสดงออก ถ่ายทอดไอเดียอย่างมั่นใจ เหมาะกับงานที่ต้องการการริเริ่มและการนำเสนออย่างสร้างสรรค์
4,2,"[66, 69, 70, 96, 126, 127, 144]", มีทักษะการแปลความหรือสื่อสารข้อมูลเชิงลึกให้ง่ายต่อการเข้าใจ สามารถถ่ายทอดข้อมูลสำคัญให้ผู้รับสารเข้าใจตรงจุด และตอบโจทย์เป้าหมายของงานได้ชัดเจน
4,3,"[117, 118, 142, 143]", มีความสามารถในการวิเคราะห์ประเด็นที่ซับซ้อนและเปลี่ยนแปลงได้อย่างรอบคอบ สามารถเชื่อมโยงข้อมูลและหาแนวทางแก้ไขได้อย่างมีเหตุผล
4,4,"[71, 79, 196]", เข้าใจอารมณ์และความรู้สึกของผู้อื่น สื่อสารและช่วยเหลือได้อย่างจริงใจ เหมาะกับงานที่ต้องดูแลหรือสนับสนุนคนอื่นในหลากหลายสถานการณ์
4,5,"[141, 142, 143, 144]", คิดอย่างเป็นระบบและแม่นยำ เข้าใจความหลากหลายของผู้คนและสถานการณ์ สามารถปรับวิธีการทำงานให้เหมาะสมกับแต่ละบริบทได้ดี
5,0,"[119, 120, 121, 122, 191]", สื่อสารได้อย่างแม่นยำและคล่องแคล่ว พร้อมทำงานภายใต้ความกดดันสูงโดยไม่ลดทอนคุณภาพของงาน เหมาะกับงานที่ต้องตัดสินใจหรือดำเนินงานอย่างรวดเร็ว
5,1,"[73, 75, 217, 218]", เปี่ยมด้วยความคิดสร้างสรรค์และกล้าแสดงออก พร้อมนำเสนอไอเดียใหม่ ๆ ได้อย่างมั่นใจ เหมาะกับงานที่เกี่ยวข้องกับศิลปะ การสื่อสาร หรือการนำเสนอ
5,2,"[67, 68, 124, 128, 129, 130, 131, 132, 193]", เข้าใจเนื้อหาและข้อมูลเชิงลึก พร้อมสื่อสารหรือถ่ายทอดความหมายได้อย่างชัดเจน มีความละเอียดอ่อนและเห็นคุณค่าในสิ่งที่ทำ
5,3,"[131, 192, 193, 260]", มีทักษะด้านความเข้าอกเข้าใจ (Empathy) สามารถติดต่อและดูแลผู้ที่มีความต้องการเฉพาะ หรืออยู่ในสถานการณ์ที่ต้องการความช่วยเหลือเป็นพิเศษได้อย่างเหมาะสม
5,4,"[76, 78, 80, 81, 263, 264]", ทำงานอย่างแม่นยำ มีความคิดเชิงโครงสร้างและความคิดสร้างสรรค์ผสมผสานกัน เหมาะกับงานที่ต้องใช้การวางแผนและออกแบบอย่างมีระบบ
5,5,"[80, 81, 76, 78]", รับผิดชอบต่อคุณภาพของผลิตภัณฑ์หรือบริการ เข้าใจความต้องการของผู้ใช้ และสามารถสร้างสมดุลระหว่างมาตรฐานคุณภาพกับความพึงพอใจของผู้ใช้ได้อย่างเหมาะสม


